<?xml version="1.0" encoding="UTF-8"?>
<STL-Sheet name="Car Insurance" xmlns:xsi="http://www.w3.org/2001/XMLSchema-instance" xsi:noNamespaceSchemaLocation="shtisel-v1.xsd">
	<STL-Layout rows="7" columns="7">
		<STL-Size column-width-units="10" rows-height-units="1"/>
	</STL-Layout>
	<STL-Cells>
		<STL-Cell row="4" column="B">
			<STL-Original-Value>AIG</STL-Original-Value>
		</STL-Cell>
		<STL-Cell row="5" column="B">
			<STL-Original-Value>WOBI</STL-Original-Value>
		</STL-Cell>		
		<STL-Cell row="6" column="B">
			<STL-Original-Value>SHIRBIT</STL-Original-Value>
		</STL-Cell>					
		<STL-Cell row="3" column="C">
			<STL-Original-Value>mandatory</STL-Original-Value>
		</STL-Cell>		
		<STL-Cell row="4" column="C">
			<STL-Original-Value>1000</STL-Original-Value>
		</STL-Cell>		
				<STL-Cell row="5" column="C">
			<STL-Original-Value>900</STL-Original-Value>
		</STL-Cell>		
				<STL-Cell row="6" column="C">
			<STL-Original-Value>5555</STL-Original-Value>
		</STL-Cell>						
		<STL-Cell row="3" column="D">
			<STL-Original-Value>3rd party</STL-Original-Value>
		</STL-Cell>		
		<STL-Cell row="4" column="D">
			<STL-Original-Value>800</STL-Original-Value>
		</STL-Cell>		
				<STL-Cell row="5" column="D">
			<STL-Original-Value>1100</STL-Original-Value>
		</STL-Cell>		
				<STL-Cell row="6" column="D">
			<STL-Original-Value>4444</STL-Original-Value>
		</STL-Cell>		
		<STL-Cell row="3" column="E">
			<STL-Original-Value>Total</STL-Original-Value>
		</STL-Cell>		
		<STL-Cell row="4" column="E">
			<STL-Original-Value>{PLUS,{REF,C4},{REF,D4}}</STL-Original-Value>
		</STL-Cell>		
				<STL-Cell row="5" column="E">
			<STL-Original-Value>{PLUS,{REF,C5},{REF,D5}}</STL-Original-Value>
		</STL-Cell>		
				<STL-Cell row="6" column="E">
			<STL-Original-Value>{PLUS,{REF,C6},{REF,D6}}</STL-Original-Value>
		</STL-Cell>								
	</STL-Cells>
</STL-Sheet>
