<?xml version="1.0" encoding="UTF-8"?>
<STL-Sheet name="intermediate" xmlns:xsi="http://www.w3.org/2001/XMLSchema-instance" xsi:noNamespaceSchemaLocation="shtisel-v1.xsd">
	<STL-Layout rows="20" columns="5">
		<STL-Size column-width-units="4" rows-height-units="1"/>
	</STL-Layout>
	<STL-Cells>
		<STL-Cell row="3" column="A">
			<STL-Original-Value>3.14</STL-Original-Value>
		</STL-Cell>
		<STL-Cell row="3" column="B">
			<STL-Original-Value>2</STL-Original-Value>
		</STL-Cell>
		<STL-Cell row="3" column="C">
			<STL-Original-Value>{TIMES,{REF,A3},{REF,B3}}</STL-Original-Value>
		</STL-Cell>
		<STL-Cell row="4" column="A">
			<STL-Original-Value>{PLUS,{REF,C3},4}</STL-Original-Value>
		</STL-Cell>
		<STL-Cell row="4" column="B">
			<STL-Original-Value>{CONCAT,Hello, World}</STL-Original-Value>
		</STL-Cell>
		<STL-Cell row="4" column="C">
			<STL-Original-Value>{SUB,HelloWorld,4,7}</STL-Original-Value>
		</STL-Cell>
	</STL-Cells>
</STL-Sheet>
