<?xml version="1.0" encoding="UTF-8"?>
<STL-Sheet name="beginner" xmlns:xsi="http://www.w3.org/2001/XMLSchema-instance" xsi:noNamespaceSchemaLocation="shtisel-v1.xsd">
	<STL-Layout rows="3" columns="5">
		<STL-Size column-width-units="15" rows-height-units="3"/>
	</STL-Layout>
	<STL-Cells>
		<STL-Cell row="2" column="B">
			<STL-Original-Value>Hello</STL-Original-Value>
		</STL-Cell>
		<STL-Cell row="2" column="C">
			<STL-Original-Value>Menash</STL-Original-Value>
		</STL-Cell>
		<STL-Cell row="2" column="D">
			<STL-Original-Value>{CONCAT,{REF,B2},{REF,C2}}</STL-Original-Value>
		</STL-Cell>
	</STL-Cells>
</STL-Sheet>
